Date,Stars,Reviews,BankName
02-05-2017,5,I have taken a housing loan with PNB housing Finance and my loan experience was very good. The loan amount was for Rs 16 lakhs with the rate of interest of 11% which is nominal rate. The process was smooth and i received my loan amount on time. Customer service was good and they followed on time. The tenure of this loan is 10 years.,PNB Housing Finance
06-11-2016,5,"My home loan is with PNB housing finance. The experience is good I got the loan on time. The whole process was completed in less than a month. The documentation was taken on proper time. I am still waiting for the register copy document. The rate of interest is of 8.35% and I am not clear about the processing fees, as there were few cheques being debited in my account.",PNB Housing Finance
14-02-2016,5,"I had taken my home loan from PNB housing finance limited. It was a bit of a lengthy process for the documentation and the rate of interest was of 8.80% it was not reduced as promised as per RBI, I need to go and request for it. Else it was a good experience.",PNB Housing Finance
26-06-2016,1,"I took home loan from pnbhfl and without any information they increased ROI. They don't follow RBI guidelines and even for small things you need to visit branch. Their customer support is very pathetic. My sincere request never take home loan from pnbhfl they are money suckers.
",PNB Housing Finance
27-12-2016,5,"The documentation process was quite good with PNB HOUSING FINANCE LIMITED, they haven't made delay in the documentation and the disbursement. They took around 15 days time to disburse my home loan amount . The rate of interest and charges are average with the PNB HOUSING FINANCE LIMITED .",PNB Housing Finance
31-05-2017,5,I have taken a home loan with PNB Housing Finance and my loan experience was very good. The loan amount was for Rs 4 lakhs with the rate of interest of 9% which is nominal when compared to other banks. The process was smooth and the tenure of this loan is 4 years. Customer service was good and they responded on time.,PNB Housing Finance
23-01-2016,3,I had taken my Home loan from PNB HOUSING FINANCE a long time back and the experience has not been that great. The services where not user friendly and the response from their end had not been good as well. The interest rate and the charges where nominal but overall the process has taken more time than expected.,PNB Housing Finance
28-04-2016,5,I got the home loan with the Punjab National bank housing finance limited and the rate of interest is according to the market trends while compare with other competitors. The speed of the process was an awesome one with them till now.,PNB Housing Finance
02-02-2017,5,Punjab National Bank housing finance limited response was an excellent one for my home loan. The advantage is their lesser rate of interest and the response was good and the executive have helped me in all different way.,PNB Housing Finance
01-01-2018,5,Rate of interest was around 8.35% for the Home loan with the Punjab National Bank Housing Finance Limited and it took around a month of time to get the disbursement from them. Everything is good and the processing charges are good too.,PNB Housing Finance
27-12-2016,4,PNB need to take care for legalizing all the project . Because I paid some extra fees for legal charge . They taken one month for sanctioning my Home loan .Delay involved from my side and bank. I dont find any issue with the interest rate as 9.1 % . I got a good service from PNB .,PNB Housing Finance
15-01-2016,5,"I have taken a housing loan with PNB housing finance and it was a good loan experience. The process was smooth and i received my loan amount within the stipulated time. The loan amount was for Rs 30 lakhs with the rate of interest of 8.35% which is nominal when compared to other banks. Customer service was good, they collected documents on time and their response was good. The processing fees was nominal and the tenure of this loan is 15 years.",PNB Housing Finance
21-02-2016,5,"I actually was looking for a transfer of my home loan . I cancelled the application from my side , actually I postponed my plan from my end . Customer service was good from the bank . All the required Information was given to me on time from their side . Over all it was a good with PNB housing finance .",PNB Housing Finance
30-01-2016,5,It was good experience with PNB Housing finance i would say as i applied for a Home loan in there . Actually i postponed the plan of buying a house now so i cancelled it . The Customer service was good from the PNB side . All the Information was given to me in a proper way .,PNB Housing Finance
11-06-2016,5,It was a good experience with PNB Housing finance as i apploed for a Home loan . the bank people said that they can't provide the loan Due to rules they said i was not properly informed on that point . The customer service was good from the bank side . they informed me everything in a detailed way .,PNB Housing Finance
17-04-2017,4,"I took 18L as a home loan in PNB Housing Finance and it was a good experience. I have done a comparison and found the rate of interest is lower than other banks. I got the rate of 8.35% per annum and 5K as a processing fine. The loan duration is 30 years.
        ",PNB Housing Finance
04-03-2017,5,"Actually i was looking for a loan transfer .The Customer service was good from the PNB HOUSING FINANCE . All the Information was given to me in a proper way .The rate of interest was also told . I canceled the application from my side . I got a better offer on the rate of interest in the same bank i was holding the loan with ,so i went on with that option . i can say it was a good experience with the PNB housing finance .",PNB Housing Finance
06-11-2016,5,"As i applied for a home loan in PNB Housing finance it was a good experience with them . The Customer service was good from the bank side . The bank contacted me on time and was in touch till when i was replied back , and delivered all the Information which was required for the loan process . It was a good service i believe .",PNB Housing Finance
24-12-2017,5,It was a good experience with PNB Bank side i had for the home loan process . I actually changed my plan and i kept it hold so did not opt for the loan . It was a good Customer service from the HDFC Bank side . All the required Information was given from the bank executive side . It was a happy experience over all .,PNB Housing Finance
23-01-2016,3,"I had taken a Property loan from PNBHFL since they where the only providing the loan against property, where the interest rate was also competitive, The process took a bit of a time but the person who came to collect the documents was professional and was helpful. The processing charges where nominal but their customer support was not that great.
        ",PNB Housing Finance
01-01-2016,5,"It was a good customer service the PNB Housing finance provided for the home loan process . On the property i wanted to take the loan on , the bank was only providing 80% approval and they were not able to provide a top up loan on that loan , the rate of interest was good provided to me . I did not get a full approval so i did not opt for the loan . It was good experience with PNB Housing .",PNB Housing Finance
02-12-2017,5,"I have taken home loan from PNB Housing Finance, it was overall a good loan experience. The tenure of this loan is 24 years which is quite satisfactory. The loan amount was for 11.35 lakhs with the rate of interest of 8.5% which is nominal when compared to other sources. The process was very smooth and my loan was approved within 1 week. Customer service was good, they provided door step service for the collection of documents.",PNB Housing Finance
22-10-2016,5,It was a good experience with PNB home loan. Actually everything was fixed but due to the some patta problem the bank was not able to give the loan . The Customer service was good from the bank side and actually it was helpful . All the information was given to me and regarding the loan process .,PNB Housing Finance
29-02-2016,5,"My home loan experience with PNB Housing Finance was good, the loan amount was sufficient and the rate of interest was nominal when compared to other sources. The process was very smooth and easy. Customer service was good and they responded on time. I am overall satisfied with the services provided.",PNB Housing Finance
25-07-2016,5,It was a good experience with PNB housing finance. They have disbursed the loan on time. The customer service and response was good. The rate of interest was nominal. Their executive came to my place and collected the documents. They don't charge pre closure fee for after 6 months. Overall it was excellent service.,PNB Housing Finance
16-08-2016,3,"The process in getting this card was quite good where the executives where very much helpful and where friendly. The process has taken a little more time than usual, the loan amount has been okay but it was not up to the mark as i expected. They had offered me that there will not be any processing fee but they had taken the processing fees.",PNB Housing Finance
26-10-2017,5,"I had taken my home loan with PNB hosing finance. They offered interest rate as 8.4% but the market price is 8.3%. The documentation process is easy, I had went to the branch and submitted the documents. There are no charges for pre closure. The payment option is convenient.",PNB Housing Finance
31-05-2017,5,I was just checking the rate of interest with PNB HOUSING FINANCE LIMITED. I am planning to take the loan by next march 2018 and when the executive contacted me i replied them the same. They told they will definitely help at that time. Its a good institution.,PNB Housing Finance
10-11-2017,4,"I have taken my loan with PUNJAB HOUSING FINANCE , the process was very good while taking the loan even i got my loan on time . The rate of interest is little high with this bank . Only they need to improve their customer service they was not very clear about the documents part .
",PNB Housing Finance
26-01-2017,5,The loan experience was almost great with PNB Housing Finance Ltd. They have offered me 48L as a home loan. The response was proper. They provided a doorstep service for documentation. ROI was 8.7% and I am happy with the interest rate. There is no pre closure charges. They have sanctioned the loan on time.,PNB Housing Finance
22-07-2017,5,"Due to my personal reasons i could not able to process the loan from PNB HOUSING FINANCE LIMITED. When i got a call from PNB i informed about my current status.I am happy with the institution, so that i can consider PNB in future for my home loan.",PNB Housing Finance
02-02-2017,5,I have requested for a home loan with PNB HOUSING FINANCE LIMITED. But later i changed my plan of taking the home loan.In future if i am planning to take the home loan then i will definitely consider PNB HOUSING FINANCE LIMITED . They gave good response.,PNB Housing Finance
30-01-2016,4,Based on the interest rate and the processing charges I went with PNB for my home loan. And PNB didn’t let me down they offered me an interest rate of 9.50% P.A and the processing fees was also low. My loan was approved in 7 working days.,PNB Housing Finance
14-10-2016,5,I have approached PNB for my home loan. I am satisfied with the customer service and responses which was on time . They did proper follow ups also but I have postponed the plan so cancelled the application .I have no idaea bout the rate of interest here.My overall experience was excellent service and It recommendable also .,PNB Housing Finance
19-03-2017,5,I have applied for my home loan with PNB . The rate of interest was 12.5% which was average than other banks in the market. There is no requirement for the loan now so I have cancelled the application. The customer service and responses was up to the mark.,PNB Housing Finance
17-12-2017,5,"I have applied for my home loan with PNB . The rate of interest was 12.5% which was average in the market. There is no require,met for the loan now so I have cancelled the application. The customer service and responses was up to the mark.",PNB Housing Finance
02-12-2017,5,"It was a very easy and quick process with PNB for my home loan service, the documentation part was very easy interest rate what they quoted to me was fine when compared to others in the market and the payments were done through online ecs. In all it was totally an excellent experience with PNB for my home loan service.",PNB Housing Finance
09-08-2016,4,"PNB housing taken short span of time to disbursed the loan amount as per my requirements, they have fulfilled my needs. The interest rate is around 9.99% its nominal compared to other banks, they gave me the flexible emi options and it is very much satisfactory.",PNB Housing Finance
10-02-2017,5,It was a very good experience with PNB housing finance. I have taken my home loan. The customer services are good and they collected my documentation on time and at one go. The rate of interest was of 8.5% and the processing charges was also normal.,PNB Housing Finance
24-04-2017,4,"I got great response from PNB housing, but I am not fine with interest rate, earlier they told something and again after the disbursement they collected Rs. 2500. It would be if they informed it earlier. Remaining all good I don't have any issues.",PNB Housing Finance
04-06-2016,5,PNB housing finance was overall good for the home loan. But the customer services and response was not that up to the mark. I only had to contact them to check on the status and I had to do all the follow ups. The rate of interest was of 10.5% fixed and the processing charges are high.,PNB Housing Finance
19-09-2017,5,My home loan is with PNB. The rate of interest was 8.25% which was satisfactory and I have taken 27 lakhs loan amount. The customer service and responses was up to the mark. I am happy with the loan process and they have provided door step service for collecting documents. The processing fee was 8000 and Its nominal. My experience was very good here and Its recommendable.,PNB Housing Finance
17-12-2017,5,Due to my personal reasons i had to cancel the home loan with PNB HOUSING FINANCE.The follow ups with the bank was good.The executive gave me regular feedback and even understand all my situation. They assured me that if in future if i am planning to take loan then they told they will definitely help.,PNB Housing Finance
17-04-2017,5,It was good customer service from the PNB Housing finance as i applied for the home loan process . The rate of interest was 8.75% nominal as compared from the other banks and also the processing fee . Everything was good from the PNB side . I asked for a tenure of 20 years and the bank said we can not provide that so i did not opt for the loan . Rest everything was good only from their end .,PNB Housing Finance
20-12-2016,4,I applied for my home loan through Finance Buddha website with PNB. Within an hour I got the confirmation call from the Finance Buddha executives and the documentation process started from next day. My loan was approved within 9 working days. I will use PNB for my financial help in future also.,PNB Housing Finance
24-02-2017,5,I did not go ahead with PNB housing finance for the home loan as the house I wanted to purchase was already sold to another customer. The customer services are very proactive and they had the lowest deal on the interest rate and processing charges.,PNB Housing Finance
02-11-2017,5,Since I went ahead with another bank I did not take the home loan with PNB housing finance. But they were excellent in the customer services and they are responsive too. They had the lowest rate of interest of around 8% and the processing charges are normal.,PNB Housing Finance
07-03-2016,5,The customer and response is good from PNB Housing Finance. I have taken home loan as 28L with the duration of 20 years. I have purchased a residential property. The loan disbursement was on time. For documentation they provided a doorstep. Rate of interest is compaatively good and not the best. I pay 25K/month through my salary account. Overall service is good,PNB Housing Finance
01-01-2016,4,"My experience was excellent with PNB housing loan, I have this bank because of the good tenure period, I have taken 25 lakhs for the tenure of 17 years. They are providing attractive interest rate with the better process and also they are providing friendly service.
this man is amazing!!!   i said it all in the orginal review.  i would deal with him again and again

thank you Bryan
        ",PNB Housing Finance
07-07-2017,5,I have taken a Home loan with PNB housing finance limited and my experience with them has been good throughout the process of my loan. I received a good service and response from them during that time and had no major issues. I am also comfortable with their rate of interest and charges.,PNB Housing Finance
25-11-2017,5,I have applied for the home loan from PNB housing finance. I am happy that my loan application was approved and the requested amount was disbursed. The customer service was good and i liked their way of approach. They provided door step service for the collection of documents. The rate of interest is nominal when compared to other sources.,PNB Housing Finance
03-07-2016,5,"Got the Home loan with PNB HOSING FINANCE LTD within 2weeks of time, best is that they are very quick in response, the customer support was prompt with PNB HOSING FINANCE LTD. The rate of interest is nominal with PNB HOSING FINANCE LTD. I am satisfied with the loan amount too.",PNB Housing Finance
24-12-2017,4,"The documentation process with PNB went very smooth and hassle free. The staff of the bank helped me a lot with the documents and provided me correct information about all the charges. My home loan was approved within 10 days. The interest rate was 10.50% P.A which was affordable to me. So it was an overall good experience with PNB.
",PNB Housing Finance
02-08-2016,5,It was a good experience at PNB housing finance for the home loan. Mr. Uday sharma has worked well and he kept following up on the application. The interest rate was reasonable when compared to the other banks. The processing charges was around 6K.,PNB Housing Finance
24-08-2016,5,I have taken a home loan with PNB Housing Finance Limited and the entire process for the loan has been a smooth experience. The procedures was well organised and was completed on time. It was comfortable for me as the documents were collected by an executive and it saved me time and effort. The rate of interest was also nominal.,PNB Housing Finance
28-04-2016,5,Good customer service was done good from the PNB side it was I can say a good experience . The rate of interest provided from the bank side was good and even the processing fee . I work in oriental bank so I took a loan from that bank it was easy for me to opt that loan .,PNB Housing Finance
15-06-2017,5,The housing loan was good with PNB HOUSING FINANCE LIMITED was good. The customer support support gave good response . The rate of interest is nominal with PNB HOUSING FINANCE LIMITED when compared with others. I would say it was an excellent service which was given by PNB.,PNB Housing Finance
04-01-2017,4,"The process in getting this loan has been smooth and easy and the loan amount which they had provided had been satisfactory as well. The interest rate with them has been nominal when compared with the market rate. There has not been any sort of additional charges which have been made by them.
",PNB Housing Finance
09-08-2016,5,"PNB Housing loan is the best, PNB offered the least interest rate as compared to SBI, processing was very easy they had taken around 2 weeks for the disbursement . Its a joint loan. I had received the copy of tittle deeds and legal documents to my email id on time.",PNB Housing Finance
02-08-2016,5,"The property which I was identified it was not finalized because of some reason. That is the reason I haven't avail any loan from PNB housing but once I have finalized the property, surely I have idea to go with PNB housing its very comfortable.",PNB Housing Finance
28-04-2016,5,The home loan service was good with PNB HOUSING FINANCE LIMITED . I got the loan amount within 15 to 20days of time. The customer service was prompt from PNB HOUSING FINANCE LIMITED . The rate of interest is same when compared with other banks.,PNB Housing Finance
13-12-2016,5,I have taken my home loan with PNB. The rate of interest was 8.5% which was average . The customers service and response was up to the mark. They have provided door step service for documentation service and sanctioned the loan with the committed time. My overall experience was excellent.,PNB Housing Finance
16-08-2016,2,"The reason why my home application is closed with PNB Housing Finance is because the rate of interest and the charges are very high when compared to all other sources in the market. When it comes to customer service, it was not up to the mark and their response was delayed.",PNB Housing Finance
10-07-2016,5,"I have not shortlisted the property yet, once it got finalized from my end, I will reach the PNB housing to take a home loan. But they gave me best offer on home loan even I checked with them, the bank ready to give good principal amount according to my requirement but I kept on hold.",PNB Housing Finance
17-12-2017,5,I planned to take a home loan from PNB HOUSING FINANCE LIMITED.Later i inquired with many other banks too and i found IDBS provide better rate of interest than PNB. So i thought not to take loan from PNB.But the service and response at the time of application was good.,PNB Housing Finance
26-06-2016,5,"PNB housing ready to sanction requested amount,t they gave very good support and interest rate is also good. I got good follow up with PNB housing. But I was dropped the plan due to my personal commitment apart from that I don't have any issues with the bank.",PNB Housing Finance
17-12-2017,5,"Right now, I don't have any idea to take home loan, I changed my mind only because of the personal reason. I will be applying the home loan after two month. PNB housing is one the good institute where we get good response, and their interest rate is nominal as per the market.",PNB Housing Finance
09-12-2017,1,"This PNBHL is very very bad housing loan company. High rate of interest and really POOOR service.

",PNB Housing Finance
11-06-2016,5,"I was postponed my plan to finalize a property right now because of the personal reason, Hence I don't have interest to take home loan from PNB housing. However I am quite satisfied with their response was nice, they have called couple of time to confirm my requirement. Finally I informed my decision.",PNB Housing Finance
27-12-2016,2,"My experience with the Punjab National Bank Housing Finance Limited was not up to the mark for the home loan, which I have applied. It took around two weeks of time to handover the cheque . I would like to suggest that they need to improve their servces.",PNB Housing Finance
29-10-2016,5,"The approach from Punjab National Bank was good. There were no issues with the bank side. Since I have not choosen my property yet, requested them to keep my application on hold. Overall I had a good service with Punjab National bank. They do charge a nominal rate of interest.",PNB Housing Finance
24-02-2017,5,"PNB housing interest rate is very good, they not collecting any mortgage fee, I already had one more home loan with PNB housing. Their interest rate was also very standard as per the market. Hence I am completely okay with them, I don't have any issues.",PNB Housing Finance
04-03-2017,2,"The reason why my home application is closed with PNB Housing Finance is because the rate of interest and the charges are very high when compared to all other sources in the market. When it comes to customer service, it was not up to the mark and their response was delayed.",PNB Housing Finance
06-08-2017,2,My home loan was taken with PNB but I am not satisfied with the PNB housing finance. They didn't respond properly. They are not updating the customer. The loan process was delayed. There is no acknowledgement for the document collection. I would appreciate if they provide a better service.,PNB Housing Finance
24-04-2017,4,"I am thankful to PNB for helping me in purchasing a new home. PNB approved my home loan within 4 working days. The loan was approved to me at 9.50% interest rate. The processing fees was also low as compared to other Banks.

",PNB Housing Finance
02-04-2017,5,"I have applied for home loan from PNB Housing Finance, i did not take the loan as i dropped the plan due to the property which i have taken was not fixed. When it comes to customer service, initially they called and said there is no processing fee and when they called for the second time they said processing fees will be charged which is 6% on the principal amount. The only thing i was satisifed is with the rate of interest.",PNB Housing Finance
30-01-2016,5,"I can say the service is good from PNB ,I use to get good and regular followups . Even the representatives and customer service is very helpful and responsible also the rate of interest they offered is fine ,I can say the overall service is very excellent from PNB for my home loan service.",PNB Housing Finance
26-06-2016,5,"I have applied for home loan through PNB Housing Finance, i did not take the home loan as i dropped the plan due to some personal reasons. When it comes to customer sertvice, it was very good, they were in touch all the time. I am also satisfied with the rate of interest of 8.6% which is nominal when compared to other sources.",PNB Housing Finance
