Date,Stars,Reviews,BankName
05-12-2016,1,Their is no processing fee for my Home loan. The communicating is different and they are doing different. They initially said the interest rates 8.33% but they offered me 8.5%. Until the money is disbursed they did not inform me. The agent to whom i submitted the documents he does not know anything about the company. He gave fully wrong information Since he is new. It took 2 months to process my loan. I'm not satisfied with the PNB Housing.,PNB Housing Finance
09-12-2017,5,"My housing loan experience was good it was hassle free, I don't have to go to any of the branch. The field executive gave me the door step service, it took one month of the time for the whole process completion. They sanctioned the amount in one slot with better interest.",PNB Housing Finance
20-12-2016,1,"They are not well equipped. Every time the requirement is changing. Even the employees not aware of the procedure. Initially they offered a interested 8.35%. After i submit the submitted the documents and received the sanction letter the increased to 8.40%. Initially they are not informed me about the Insurance premium. After 2 months installment, they have blocked some amount of Rs. 36000 without any information to me. When i asked them they told me that this amount will be adjusted if I am not paying any EMI at any services.",PNB Housing Finance
24-05-2017,5,"Earlier I had the loan from PNB, then I switched over to ICICI, because of the rate of interest . Remaining all very good even the customer support is very proactive, the bank documentation process was hassle free, I don't want reach out to the bank for any concern. The executive gave me the door step service to avail the housing loan.",PNB Housing Finance
04-01-2017,4,"PNB Housing Finance is good and done the process was very faster. I think, the charges are little bit high compared to others. The loan amount was not sufficient and I have purchased a residential property. The interest rate is 10.5%. They assured for 14L but they have provided only 10L which could have been better.
",PNB Housing Finance
23-06-2017,4,"I have taken a home loan with PNB HOUSING FINANCE on 8 months before which was processed directly with them. At that time I was in need of money, other banks need all documents to submit for verification but in PNB process was good and they asked to submit required documents only. I was in need of 22L but they have sanctioned a amount of 21.20 L and tenure period of 30 years. Rate of interest is floating so as of now 8.15%. Pre closure option is applicable.",PNB Housing Finance
26-10-2017,5,I bought the home loan from PNB housing. Based on the customer requirement they are providing the loan. Their loan process was fast and they have sanctioned the loan immediately. As per the RBI Guidelines they are following up the interest rates. It took minimum of 45 days to provide the loan. The staff response was really awesome.,PNB Housing Finance
30-01-2016,2,"It was a good experience with online so far, they provide good services when compared to all other sources in the market. Customer service was good and they responded on time.i feel its easy and best way for taking loan i felt it very easy process.",PNB Housing Finance
30-09-2016,5,"I have applied for PNB HOUSING FINANCE LTD recently, the loan amount they have given me was sufficient, and the rate of interest they have charged me was up to 8.9% which is nominal compare to market price, and the processing fee they have charged me was nominal, and the loan was on time.",PNB Housing Finance
17-12-2017,3,"I took one home loan from pnb housing finance last one year three months back , and my loan amount is 25L , rate of interest is 8.20%, this interest is fix only one years now I do not know what is rate of interest , and EMI amount is 20K , tenure is 30yers , I am satisfied with this loan ,",PNB Housing Finance
17-02-2017,5,The customer care service of PNB Housing is excellent. The interest rates are higher compared to other banks. They have offered me a interest rate of 9.10%. Already they have sanctioned the loan on time. Total tenure period of the loan upto 30 years. I withdrawn the amount of Rs. 25.50 lakhs,PNB Housing Finance
05-12-2016,5,"I have been using PUNJAB NATIONAL BANK for home loan recently. Their service is good, they have charged me nominal rate of interest up to 9.5% it is nominal compare to other bank,and their processing fee they have charged me was nominal,the loan amount they have given me in this bank was sufficient. The loan was process on time.",PNB Housing Finance
13-11-2016,2,"I have applied for the home loan from PNB Housing, my loan application was approved and the experience was not up to the mark. The process was very long and it took 3.5 months to receive the loan amount. The rate of interest of 8.35% is nominal rate in the market. Customer service was not up to the mark and their response was delayed.",PNB Housing Finance
26-01-2017,5,"I have been using my home loan with PUNJAB NATIONAL BANK. Their service is good, they have given me sufficient loan amount ,and the rate of interest they have charged me up to 9% it was nominal , it is not fixed rate of interest it varies, and they have charged me processing fee it is up to 5600 it is nominal, and loan was on time, i directly went and approach through bank.",PNB Housing Finance
25-07-2016,1,"My home loan application was closed with PNB Housing Finance, the reason behind closing the application is because there was no proper response from the customer service of PNB and they did not follow up on time. The rate of interest was high when compared to other sources.",PNB Housing Finance
08-09-2016,4,"PNB Housing Finance is good and done the process was very faster. I think, the charges are little bit high compared to others. The loan amount was not sufficient and I have purchased a residential property. The interest rate is 10.5%. They assured for 14L but they have provided only 10L which could have been better.
        ",PNB Housing Finance
07-07-2017,5,"I have taken my home loan with PNB Bank.The process was very good and the loan amount was 65 lakhs . The interest rate was very satisfactory . The tenure period was 30 years . I had a good service here and the processing fee was nominal. The loan was sanctioned with the committed time ,",PNB Housing Finance
13-11-2016,5,"My experience with PNB Housing Finance for home loan was good, the process took 1.5 months to complete. The loan amount was for Rs 28 lacs with the tenure period of 15 years. The rate of interest was nominal when compared to others. Customer service was good and they responded on time.",PNB Housing Finance
06-02-2016,1,"I have my home loan application approved with PNB Housing Finance, the reason why application is closed is because there was no proper response from the customer service of PNB Housing and they did not follow up on time. The rate of interest is nominal when compared to other sources.",PNB Housing Finance
15-09-2016,5,"My home loan was taken with PNB.The loan amount was 14.70,000 and the interest rate was satisfactory . The EMI period was 30 years . I had a smooth process and the documentation was quite easy here. The loan was approved on time and the processing fee was also nominal",PNB Housing Finance
17-12-2017,5,"It was a good experience with PNB Finance for Home loan, the process was smooth and the loan amount was disbursed in 1 month. Customer service was good and they collected documents on time. The loan amount was for Rs 11 lacs with 25 years of tenure and nominal interest rate.",PNB Housing Finance
28-08-2017,1,"I had worst experience with PNB financing. They are not transparant. keep increasing the interest rate even other banks reduced based on RBI suggestion, they did not intimate on the increase in interest rate. It started in 8.6 and landed in 10.25 interest. also, be carefull on the insurance for the loan. without knowledge they had added 2.2 lakhs. right now, I am going for other bank.",PNB Housing Finance
02-05-2017,2,"I have applied for the home loan from PNB Housing, my loan application was approved and the experience was not up to the mark. The process was very long and it took 3.5 months to receive the loan amount. The rate of interest of 8.35% is nominal rate in the market. Customer service was not up to the mark and their response was delayed.

        ",PNB Housing Finance
16-08-2016,1,The agents guide you take your paper and keep it to them self for months and will not respond to you properly. once you start bugging you on customer care they will simply say the loan was rejected due to credit history or missing paper.,PNB Housing Finance
13-08-2017,2,"My home loan application was closed with PNB Housing Finance because they processed the application very late. Customer service of PNB was not up to the mark and there was no proper response. The rate of interest of 8.45% was nominal when compared to other banks.
",PNB Housing Finance
24-02-2017,1,"Worst housing finance, customer care, banking executives/ managers, process, charges. Thry increase roi and they will never tell you and online login not even shows you roi.",PNB Housing Finance
22-10-2016,3,PNB HOUSING FINANCE LIMITED offered the housing loan so i have taken the housing loan with this bank. The loan amount that it took more than 40 days to get the loan. The rate of interest was nominal but the executive manikandan is not upto the mark where it is uncomfortable in loan process.,PNB Housing Finance
31-05-2017,1,"So I had my worst experience with these goons fake fraud store because they don't deserve to called as company because they do fraudlent activities in Lucknow office, super rude if ask Any question plus rate of interest is too high, no proper response to customer queries.Beware of these fraudiers.

",PNB Housing Finance
07-10-2016,1,"I feel this is biggest fraud.

Do not go to them for loan and if you have loan transfer it to avoid any further loss.

Poor service no response.
",PNB Housing Finance
27-12-2016,3,PNB is very good financial bank to get the Housing loan . Based on the service and response . I am okay with the PNB LTD . PNB asked so many physical documents to submit for verification purposes . Even after submitting the docs not get the proper and fast response .,PNB Housing Finance
30-09-2016,1,3rd class. Money making mentality. While closing the home loan if the DD amount is more than outstanding loan amount everybody will give a cheque/dd for excess payment. But PNBHFL made us to get a new DD which is exactly equal to outstanding amount. They say it is impossible to close the loan account. Don't go with PNB.,PNB Housing Finance
07-03-2016,1,"Worst experience ....

Not take any loan ... Otherwise you are feel like guilty .. they are not supported after loan sention ...only making money


        ",PNB Housing Finance
11-10-2017,4,"The process is good with PNB Housing Finance. The customer service is excellent. The charges are not very clear and it has to be more transparent. They took a processing fee of 14,000 rupees for the loan amount of 60L. The tenure is 30 years. The documentation process is simple.

        ",PNB Housing Finance
28-08-2017,1,"Money looters. Any financial institutions by default give list of documents they have in their possession when avail home loan. These looter charge 590rs for giving the list of documents. Cheap way of making money...
",PNB Housing Finance
22-07-2017,1,"PNB HFL one of the worst housing finance, no proper service from pnb. I took loan from it . Interest rate very high AND following accordingly RBI rules . Ultimately u pay more than double amount.",PNB Housing Finance
09-12-2017,4,"I have taken a home loan from PNB housing finance. Initially they have started with the lowest rate and as the loan process went on, they kept increasing the rate of interest. It has not been a good. Even the processing charges are also on the higher side.
The rate re-lock-in rule was not followed.
        ",PNB Housing Finance
05-05-2016,1,"My experience is very bad , first of all.i had no choice the builder gave this bank to me as they have tie up , first the executive took my documents then he absconded and then again I had to submit the documents then the second executive was also.not good no response we had to hunt him amd the they gave me the loan on 9.45% ROI which is so high even during pandemic they are not ready to reduce ROI after we having pay cut. All the other banks have rate of interest of 7 to 8% .Even for PM yojana I had to be after them the executive is not at all intrested in of your work.

When you ask them about anything they say the bank does not come under RBI rules that's strange...Please do not take loan from this bank.
",PNB Housing Finance
13-11-2016,1,"Pathetic staff and customer care service. Will suggest if anyone planning to take laon from PNB pls dont take it will be your biggest mistake in life

        ",PNB Housing Finance
13-08-2017,5,"I had a plan to take my personal loan with PNB. The interest rate is not good here so I have canceled and taken with ICICI bank since the procedure will be so simple there . I am looking for 50,000 and the interest rate was 8.55% which is bit high . The customer service and reponses was up to the mark",PNB Housing Finance
07-10-2016,5,"I have taken a personal loan from Pun jab National Bank, the experience with them what I had was very good, they were very cooperative and very responsive. I am quite happy with their response and assistance, I received the loan amount on time, and their rate of interest is also normal.",PNB Housing Finance
08-01-2016,1,"My home loan experience was not good with PNB Housing, the process was very long and it took 3-4 months to receive the loan. The rate of interest was high when compared to all other sources. Communication was no proper coordination between the agent and the customer service.",PNB Housing Finance
18-01-2017,5,"I have a got loan on time. Everything was done in a smooth process. I'm yet to pay the first month EMI. The people who are working in PNB housing are very prompt and responsive. They have offered me very good interest rate. For the first year, they have offered me interest rate of Rs. 8.4% and from the 2nd year the interest rates will be based on floating price. I have got a separate relationship manager.",PNB Housing Finance
02-12-2017,2,My home loan application was closed with PNB Housing Finance because they processed the application very late. Customer service of PNB was not up to the mark and there was no proper response. The rate of interest of 8.45% was nominal when compared to other banks.,PNB Housing Finance
29-02-2016,5,"I have applied for the home loan from PNB Housing Finance, my loan application was closed because the builder suggested to get the pre approved loan from the bank. The customer service was good, i liked their way of response and they followed up on time. The rate of interest was high when compared to other sources.",PNB Housing Finance
19-10-2017,3,"I earlier had my home loan with PNB housing finance limited. It was not a up to the mark experience. When there was a time the interest rates was reducing they never did it for the existing customer. But they increased it when the rates went high. I am not happy about the same.

        ",PNB Housing Finance
15-01-2016,5,"I have got a on time. I have to wait for sometime on registration. The representative was very helpful. I never called with their customer care. I have applied a loan amount of Rs. 35 lakhs. They charging 2.5 % as processing fee and interest rate of 8.5%. Overall, I'm satisfied with the PNB housing.",PNB Housing Finance
07-03-2016,1,"It took close to 4 months to get my loan... When I applied I was promised some interest rate, since it took 4 months to approve, they have increased my rate.... Moreover it's a continuous headache to keep following up with them... So would NOT suggest anyone to go with them",PNB Housing Finance
04-01-2017,5,The Best thing about PNB housing is familiar staff and prompt response from them. I have applied a loan amount of 1 Cr. They have offered me a interest rate of 8.35 %. The response from the people who working in PNB. I used to make the loan through Auto debit.,PNB Housing Finance
16-08-2016,2,I have taken a home loan with PNB Housing Finance and my loan experience was not up to the mark. The loan amount was for Rs 56 lakhs with high interest rate when compared to all other sources. The process was quick and i received my loan amount within 10 days. There are too many charges in this loan not satisfied with the customer service offered by PNB Housing Finance.,PNB Housing Finance
27-05-2016,5,They have reduced the interest rate upto 8.5%. The overall documentation went very smooth. I have got the loan on time. I have applied around 45 lakhs as my loan amount. I'm paying around Rs. 68000 for my loan. I have chosen 10 years as tenure period. I never called their customer care people.,PNB Housing Finance
12-09-2017,5,The Best thing about PNB housing is familiar staff and prompt response from them. I have applied a loan amount of 1 Cr. They have offered me a interest rate of 8.35 %. The response from the people who working in PNB. I used to make the loan through Auto debit.,PNB Housing Finance
17-05-2017,4,"I was having personal loan hence PNB told to close my existing loan to take the housing loan. Initially I took the loan with the interest of 8.5% suddenly they reversed to 9.5% without any intimation from pnb housing. The Post process need improvement and the bank response is not good. The staffs made me wait for long time they don't care about the customer.
Thank you Peter for always getting back to me right away with any questions and making sure this was a smooth process and my Loan closed on time! We appreciate this so much. 
        ",PNB Housing Finance
02-02-2017,4,"I have home loan with PNB Housing Finance and found the interest rate is very low and known in the market for a very long time. The customer service is very good. There was a processing which is average. The loan duration is 26 years. They went extra mile and done their best during the process, overall am satisfied.

        ",PNB Housing Finance
27-09-2017,5,I have got my loan on time. The documents has been discussed with the representative of bank collected the documents and checked my credit score as well. It disbursed in some times. After providing all the documents it took 7 to 10 years to get the loan. They are offering a interest rate of 8.4%. I'm happy with the loan and the services offered to me.,PNB Housing Finance
15-01-2016,5,From PNB HOUSING FINANCE LIMITED i use my housing loan. I use since 2.5 years. Fixed rate of interest that i am getting in my loan where the interest is 9.95% and it is high. I got the loan very quickly. i ma satisfied with the loan where i have taken for my loan.,PNB Housing Finance
24-05-2017,4,"My involvement with PNB for my home loan is lovely, the main thing is they should be fast as they had set aside around a month's opportunity to dispense the credit sum. Adding to that, they should be greater lucidity in their communication.
",PNB Housing Finance
03-07-2016,5,"My home loan application was closed with PNB Housing, the reason behind closing the application is because i have postponed the plan to get the home loan. Customer service was good and they followed up on time. The rate of interest was nominal when compared to other sources.",PNB Housing Finance
11-10-2017,5,"I have applied for the home loan from PNB Housing, the application is closed because the rate of interest of 8.4% was high when compared to all other sources in the market. When it comes to the customer service, it was good and they followed up on time",PNB Housing Finance
04-03-2017,5,"My home loan application was closed with PNB, the reason behind closing the application is because there was no requirement of loan as of now. When it comes to customer service, they followed up on time and the response was good. The rate of interest was nominal when compared to others.",PNB Housing Finance
26-10-2017,2,"I have taken a home loan with PNB Housing Finance and my loan experience was not up to the mark. The loan amount was for Rs 56 lakhs with high interest rate when compared to all other sources. The process was quick and i received my loan amount within 10 days. There are too many charges in this loan not satisfied with the customer service offered by PNB Housing Finance.
        ",PNB Housing Finance
23-01-2016,5,"I have applied for the home loan from PNB housing finance, my loan application was closed because the property is not ready and i have postponed the plan to get the home loan. Customer service was good and they responded on time. The rate of interest was nominal when compared to others.",PNB Housing Finance
28-04-2016,1,"Very poor responsiveness, make you run around like a govt office, charge exorbitantly for everything, don't care what the customer goes through, very poor services. They haven't been able to locate my EMI from may last year and have been asking me to pay again despite me producing my bank statement and everything, have been charging me interest on same",PNB Housing Finance
07-03-2016,5,"I have my home loan application approved with PNB Housing and the loan experience was good, the process took 10 days to complete and the documents were collected on time. Customer service was very good and they responded on time. The rate of interest was nominal when compared to all other sources.",PNB Housing Finance
05-04-2016,4,They have given the good offers with the PNB HOUSING FINANCE LIMITED so i have taken this housing loan. The documentation process was simple and easy to get the loan added on that i got the loan within couple of month. The loan amount was good and satisfactory.,PNB Housing Finance
10-04-2017,5,"My home loan experience was very good with PNB Housing Finance, i have taken loan for Rs 48 lakhs for 18 years with nominal interest rate when compared to other banks. Customer service was good and they followed up on time. The process was quick and i received my loan amount within 1 week.",PNB Housing Finance
31-08-2016,3,"I have been recently applied for housing loan with PNB housing finance,i pro-active approach my site to get loan amount soon,the loan amount was sufficient,like based on my requirement they have given me loan,and i felt the rate on interest which they have charged me was bit high,and there was delay in getting loan ,but that fine,due to some legal huddle i need loan so i did not bothered about rate of interest.",PNB Housing Finance
04-03-2017,5,"My home loan application was approved with PNB Housing and the loan experience was good, the process was smooth and i received my loan amount within 1week. The loan amount was for Rs 18 lakhs for 20 years with nominal interest rate when compared to other sources. Customer service was good and they followed up on time.",PNB Housing Finance
30-09-2016,5,"I have applied for the home loan from PNB Housing Finance, my loan application was closed because the property was out of the geographical area. The rate of interest of 8.35% was nominal rate in the market. Customer service was good, they followed up on time and their response was also good.",PNB Housing Finance
22-07-2017,5,"I have closed my home loan application with PNB Housing Finance because i do not require the home loan as of now. When it comes to customer service, it was good and they followed up on time. The rate of interest was nominal when compared to all other sources.",PNB Housing Finance
18-07-2016,5,"My home loan application was closed with PNB Housing Finance, the reason behind closing the application is, i have postponed the plan to get the home loan. Customer service of PNB was good and they followed up on time. The rate of interest was nominal when compared to other sources.",PNB Housing Finance
02-05-2017,5,PNB housing finance is good for the home loan experience. It was a on time paper work and also as per my time slot. The rate of interest is of 8.35%. There is a processing fee of 6K including GST. The customer services and response is good and supportive.,PNB Housing Finance
27-05-2016,3,"The services are good with PNB Housing Finance. The interest rate is very high when compared to other banks. They have charged me around 9.10% where Bank of Baroda offering 8.67%. There was a processing fee which was around 12K for 18L, they need to decrease the charges.
",PNB Housing Finance
26-10-2017,5,My home loan is with PNB housing finance and I am happy with the services. They are responsive and in all there are no issues to get my loan through. The rate of interest is of 8.35% and the processing charges is low too. The documents were collected on time.,PNB Housing Finance
04-10-2017,5,It was a smooth process with PNB housing finance for the home loan. I did not face any major trouble or inconvenience. The rate of interest is of 8.35% and it is the lowest rate in the market as of now. The processing charges is also normal. Overall it is good.,PNB Housing Finance
04-01-2017,5,"The overall experience is good with PNB housing finance for the home loan and there was a slight delay in the process, but that is okay for me. The rate of interest is around 8.25% and it is fixed. There was a processing fee as well. The disbursement has happened on time and as needed.",PNB Housing Finance
30-06-2017,1,"I have paid my loan account HOU/KOL/0817/418551. My loan account is closed .Even then PNBHFL is not returning my property document after so many follow ups. Dont know what to do.
",PNB Housing Finance
